Id;cod_ind_p;nome_ind_p;definicao_p;inter_p;met_calc_p;fonte_p;valor_ref_p;period_p;atuali_p;period_c_p;abrang_g_p;nivel_a_p;dimen_p;limit_p;bibli_p;quest_pen_p;bobs_p;periodo_inic;periodo_fin;sexo;ajuste;cobertura;renda;escolaridade;situacao;pnad;sus;especialista;esfera;fxetaria;tabela;erro;porte;status
87;O03;Prevalência de hipertensão;Percentual da população entre 20 e 79 anos que refere ter tido diagnóstico de hipertensão por médico ou profissional de saúde.;Estima a prevalência de hipertensão diagnosticada por médico ou profissional de saúde referida pela população.;Numerador: número de pessoas de 20 a 79 anos que referem ter tido diagnóstico de hipertensão por médico ou profissional de saúde X 100. Denominador: população total residente de 20 a 79 anos.;PNAD e PNS.;;Quinquenal.;Quinquenal.;1998 - 2013;Brasil, Grandes Regiões e UFs.;;Morbidade.;1 - A estimativa depende do acesso à consulta médica. 2 - A partir de 2004, a PNAD ampliou sua cobertura para todo o território nacional, passando a agregar as informações das áreas rurais de Rondônia, Acre, Amazonas, Roraima, Pará e Amapá.;;1 - Para o cálculo das estimativas foram consideradas as informações do desenho amostral. 2 - Os gráficos estão acompanhados dos intervalos de confiança (IC 95%). 3 - Os dados de 2013 tem como fonte a questão Q2 da Pesquisa Nacional de Saúde (PNS).;;1998;2013;0;0;3;0;0;0;1;0;0;0;0;1;0;0;S
88;O04;Incidência de dengue;Número de casos novos confirmados de dengue (clássica e febre hemorrágica da dengue), por 100 mil habitantes, na população residente em determinado espaço geográfico, no ano considerado.;1 - Estima o risco de ocorrência de casos de dengue, em períodos endêmicos e epidêmicos, numa determinada população em intervalo de tempo determinado. 2 - Está relacionada à picada do mosquito Aedes aegypti infectado com o vírus da dengue (grupo dos flavivírus), dos sorotipos 1, 2, 3 ou 4. 3 - Está associada a condições socioambientais propícias à proliferação do Aedes aegypti e a insuficientes ações de controle vetorial.;Numerador: número de casos novos confirmados de dengue (todas as formas) em residentes X 100.000. Denominador: população total residente no período determinado. Códigos CID-10: A90-A91.;SINAN.;A OMS considera que taxas acima de 300 casos por 100 mil habitantes indicam situação epidêmica.;Mensal.;Anual.;2001 - 2015;Brasil, Grandes Regiões e UFs.;;Morbidade.;1 - Depende das condições técnico-operacionais do sistema de vigilância epidemiológica, em cada área geográfica, para detectar, notificar, investigar e realizar testes laboratoriais específicos para a confirmação diagnóstica de casos de dengue. 2 - Pode apresentar subnotificação devido a dificuldades para identificar as formas clínicas leves e moderadas, que constituem a maioria dos casos de dengue. Em situações epidêmicas, esses casos tendem a ser confirmados apenas em base clínico-epidemiológica, o que impõe atenção na análise de séries temporais. 3 - Os dados utilizados neste indicador não estão desagregados por formas clínicas (dengue clássico e febre hemorrágica da dengue) nem por tipos de vírus circulantes.;;;;2001;2015;0;0;3;0;0;0;;0;0;0;0;1;0;0;S
89;O05;Prevalência de pacientes em diálise realizada no SUS;Número de pacientes submetidos a tratamento de diálise renal no Sistema Único de Saúde (SUS), por 100 mil habitantes, na população residente em determinado espaço geográfico, no ano considerado.;1 - Mede a frequência de pessoas residentes que recebem tratamento de diálise no SUS, em relação à população geral. 2 - Reflete a ocorrência de portadores de insuficiência renal crônica e a oferta de serviços de diálise no SUS. O atendimento a esses pacientes representa uma parcela importante dos recursos públicos gastos com assistência médica. 3 - A demanda por tratamento de diálise tende a acompanhar o aumento da expectativa de vida e da proporção de idosos na população. Medidas de prevenção da hipertensão, diabetes e outras doenças afetam a taxa de prevalência de pacientes em diálise.;Numerador: número de residentes submetidos à diálise renal financiada pelo SUS X 100.000. Denominador: população total residente.;SIA.;"""""""O documento """"""""Critérios e Parâmetros para o Planejamento e Programação de Ações e Serviços de Saúde no âmbito do Sistema Único de Saúde"""""""", publicado pela Portaria nº 1.631, de 1º. de outubro de 2015, traz as seguintes estimativas de casos para programação da assistência à pacientes em Diálise (estágio 5 da Doença Renal Crônica): incidência anual estimada de pacientes novos em Diálise =0,014% da população com 20 anos e mais prevalência estimada de pacientes em Diálise = 0,075% da população com 20 anos e mais óbitos estimados = 0,013% da população com 20 anos e mais. Nos países da OECD, a prevalência de pessoas em diálise aumentou de 19 para 65 por 100 mil habitantes entre 1985 e 2007. A OMS e especialistas da área estimam que 40 pacientes por 100.000 habitantes por ano necessitarão dessa terapia.""""""";Mensal.;Anual.;2008 - 2017;Brasil, Grandes Regiões e UFs.;;Morbidade.;1 - A oferta de serviços de diálise reflete a disponibilidade de recursos humanos, materiais, tecnológicos e financeiros, bem como os critérios técnico-administrativos de pagamento adotados no âmbito do SUS. 2 - Não são considerados os atendimentos em unidades sem vínculo com o SUS, embora se estime que essa parcela corresponda a apenas 4% de todos os procedimentos de diálise realizados no país.;1- BRASIL. Ministério da Saúde. Secretaria de Atenção à Saúde. Departamento de Regulação, Avaliação e Controle de Sistemas Critérios e Parâmetros para o Planejamento e Programação de Ações e Serviços de Saúde no âmbito do Sistema Único de Saúde. Brasília, Ministério da Saúde, 2015. Disponível em: http://portalsaude.saude.gov.br/images/pdf/2015/outubro/02/ParametrosSUS.pdf. 2 - OECD, Health at a Glance 2009: OECD Indicators, OECD Publishing.;;;2008;2017;0;0;3;0;0;0;1;0;0;0;3;1;0;0;S
90;O06;Avaliação negativa da saúde;Percentual da população considerada com estado de saúde ruim ou muito ruim.;Indica uma auto classificação global do estado de saúde para a qual a pessoa considera, além de possíveis doenças, o impacto das patologias ou da ausência delas no bem estar geral: físico, mental e social. As análises dos estudos mostram que este indicador está altamente correlacionado com medidas objetivas de morbidade e mortalidade.;Numerador: número de pessoas com estado de saúde ruim ou muito ruim X 100. Denominador: número total de pessoas.;PNAD e PNS.;;Quinquenal.;Quinquenal.;1998 - 2013;Brasil, Grandes Regiões e UFs.;;Morbidade.;1 - No caso de moradores ausentes, a avaliação é feita por outros moradores entrevistados. 2 - A partir de 2004, a PNAD ampliou sua cobertura para todo o território nacional, passando a agregar as informações das áreas rurais de Rondônia, Acre, Amazonas, Roraima, Pará e Amapá.;1 - Idler EL & Benyamini Y. Self-rated health and mortality: a review of twenty-seven community studies. Journal of Health and Social Behavior, 1997, 38:21-37. 2 - McDowell I & Newell C. Measuring health: a guide to rating scales and questionnaires. Oxford University Press, 1996. 3 -Sturgis P, Thomas R, Purdon S, Bridgwood A, Dodd T. Comparative review and assessment of key health state measures of the general population. Department of Health, Londres, 2001.;1 - Para o cálculo das estimativas, foram consideradas as informações do desenho amostral. 2 - Os gráficos estão acompanhados dos intervalos de confiança (IC 95%). 3 - Os dados de 2013 tem como fonte a questão J1 da Pesquisa Nacional de Saúde (PNS).;;1998;2013;1;0;3;1;2;1;1;0;0;0;0;1;1;0;S
91;O07;Incidência de Hepatite C;Número de casos novos confirmados de hepatite C por 100 mil habitantes, na população residente em determinado espaço geográfico, no ano considerado.;1 - Estima a magnitude de ocorrência da hepatite C na morbidade da população em intervalo de tempo determinado. 2 - Decorre da infecção pelo vírus da hepatite C (VHC), transmitido por via parenteral, seja através de agulhas, seringas e outros materiais perfuro-cortantes contaminados, seja pela transfusão de sangue ou hemoderivados contaminados ou através de procedimentos cirúrgicos ou odontológicos sem adequada biossegurança. Decorre também da transmissão sexual e vertical. 3 - O aumento da incidência pode indicar um baixo desempenho nas ações preventivas relacionadas às formas de transmissão.;Numerador: número de casos novos de Hepatite C em residentes X 100.000. Denominador: população total residente no período determinado. Código CID-10: B17.1.;SINAN.;A Organização Mundial da Saúde (OMS), em 2016, lançou o Global Health Sector Strategy on Viral Hepatitis 20162021: Towards Ending Viral Hepatitis, que estabelece a meta de até 2030 reduzir em 90% novos casos de hepatites virais e em 65% a mortalidade a elas associada.;Mensal.;Anual.;2007 - 2017;Brasil, Grandes Regiões e UFs.;;Morbidade.;1 - Depende das condições técnico-operacionais do sistema de vigilância epidemiológica, em cada área geográfica, para detectar, notificar, investigar e realizar testes laboratoriais específicos para a confirmação diagnóstica de hepatite C e de outras hepatites virais. 2 - Apresenta deficiências diversas na sua base de dados, como a subnotificação, que impõem cautela na apreciação dos valores encontrados, que podem não discriminar casos novos dos casos já existentes.;1 - BRASIL. Ministério da Saúde. Boletim Epidemiológico  Hepatites Virais 2018 - Ano VI  nº 01. Disponível em: http://www.aids.gov.br/pt-br/pub/2018/boletim-epidemiologico-de-hepatites-virais-2018. 2 - WHO. Global health sector strategy on viral hepatitis, 2016-2021. WHO, 2016. Disponível em: http://www.who.int/hepatitis/strategy2016-2021/ghss-hep/en/;"1 - Informações apresentadas segundo local de residência e ano de diagnóstico. 2 - A partir de 2015, houve uma mudança de definição dos casos para fins de vigilância epidemiológica. Anteriormente, eram considerados casos confirmados de hepatite C aqueles que apresentavam ambos os testes anti-HCV e HCV-RNA reagentes; em 2015, passaram a ser considerados casos confirmados de hepatite C aqueles que apresentam pelo menos um dos testes anti-HCV ou HCV-RNA reagente.";;2007;2017;0;0;3;0;0;0;;0;0;0;0;1;0;0;S
92;P01;Avaliação positiva da saúde;Percentual da população considerada com estado de saúde bom ou muito bom.;Indica uma auto classificação global do estado de saúde para a qual a pessoa considera, além de possíveis doenças, o impacto das patologias ou da ausência delas no bem estar geral: físico, mental e social. As análises dos estudos mostram que este indicador está altamente correlacionado com medidas objetivas de morbidade e mortalidade.;Numerador: número de pessoas com estado de saúde bom ou muito bom X 100. Denominador: número total de pessoas.;PNAD e PNS.;;Quinquenal.;Quinquenal.;1998 - 2013;Brasil, Grandes Regiões e UFs.;;Bem-estar.;1 - No caso de moradores ausentes, a avaliação é feita por outros moradores entrevistados. 2 - A partir de 2004, a PNAD ampliou sua cobertura para todo o território nacional, passando a agregar as informações das áreas rurais de Rondônia, Acre, Amazonas, Roraima, Pará e Amapá.;1 - Idler EL & Benyamini Y. Self-rated health and mortality: a review of twenty-seven community studies. Journal of Health and Social Behavior, 1997, 38:21-37. 2 - McDowell I & Newell C. Measuring health: a guide to rating scales and questionnaires. Oxford University Press, 1996. 3 - Sturgis P, Thomas R, Purdon S, Bridgwood A, Dodd T. Comparative review and assessment of key health state measures of the general population. Department of Health, Londres, 2001.;1 - Para o cálculo das estimativas, foram consideradas as informações do desenho amostral. 2 - Os gráficos estão acompanhados dos intervalos de confiança (IC 95%). 3 - Os dados de 2013 tem como fonte a questão J1 da Pesquisa Nacional de Saúde (PNS).;;1998;2013;1;0;3;1;2;1;1;0;0;0;0;1;1;0;S
93;R01;Abastecimento adequado de água;Percentual da população residente servida por rede geral de abastecimento, com canalização domiciliar interna, em determinado espaço geográfico, no ano considerado.;Mede a cobertura dos serviços de abastecimento adequado de água da população, por meio de rede geral de distribuição.;Numerador: população residente em domicílios particulares permanentes servidos por rede geral de abastecimento de água, com canalização interna X 100. Denominador: população total residente em domicílios particulares permanentes.;PNAD/IBGE (1998, 2003, 2008) e PNS (2013).;;Quinquenal.;Quinquenal.;1998 - 2013;Brasil, Grandes Regiões e UFs.;;Ambiental.;A partir de 2004, a PNAD ampliou sua cobertura para todo o território nacional, passando a agregar as informações das áreas rurais de Rondônia, Acre, Amazonas, Roraima, Pará e Amapá. Em áreas rurais, o abastecimento adequado não necessariamente se dá por rede geral, o que pode explicar os baixos percentuais observados nas populações rurais. Questões relacionadas a intermitência não são consideradas no indicador.;;;Para o cálculo das estimativas foram consideradas as informações do desenho amostral. Os gráficos estão acompanhados dos intervalos de confiança (IC 95%).;1998;2013;0;0;3;1;2;1;1;0;0;0;0;1;1;0;S
94;R02;Disposição adequada do esgoto sanitário;Percentual da população residente que dispõe de escoadouro de dejetos através de ligação do domicílio à rede coletora ou fossa séptica, em determinado espaço geográfico, no ano considerado.;Mede a cobertura populacional da disposição adequada do esgoto sanitário, através de rede coletora ou fossa séptica.;Numerador: população residente em domicílios particulares permanentes servidos por rede coletora ou fossa séptica no domicílio X 100. Denominador: população total residente em domicílios particulares permanentes.;PNAD/IBGE (1998, 2003, 2008) e PNS (2013).;;Quinquenal.;Quinquenal.;1998 - 2013;Brasil, Grandes Regiões e UFs.;;Ambiental.;A partir de 2004, a PNAD ampliou sua cobertura para todo o território nacional, passando a agregar as informações das áreas rurais de Rondônia, Acre, Amazonas, Roraima, Pará e Amapá.;;Requer informações adicionais sobre as condições de funcionamento e conservação dos serviços e instalações, bem como sobre o destino final dos dejetos.;Para o cálculo das estimativas foram consideradas as informações do desenho amostral. Os gráficos estão acompanhados dos intervalos de confiança (IC 95%).;1998;2013;0;0;3;1;2;1;1;0;0;0;0;1;1;0;S
95;R03;Coleta adequada de lixo;Percentual de domicílios atendidos, direta ou indiretamente, por serviço regular de coleta de lixo domiciliar, em determinado espaço geográfico, no ano considerado.;Mede a cobertura populacional de serviços regulares de coleta domiciliar de lixo.;Numerador: número de domicílios atendidos, direta ou indiretamente, por serviço regular de coleta de lixo no domicílio X 100. Denominador: número total de domicílios particulares permanentes.;PNAD/IBGE (1998, 2003, 2008) e PNS (2013).;;Quinquenal.;Quinquenal.;1998 - 2013;Brasil, Grandes Regiões e UFs.;;Ambiental.;A partir de 2004, a PNAD ampliou sua cobertura para todo o território nacional, passando a agregar as informações das áreas rurais de Rondônia, Acre, Amazonas, Roraima, Pará e Amapá.;;Considera-se a coleta de lixo: (i) direta, quando é realizada no domicílio, por empresa de limpeza urbana (pública ou particular) e (ii) indireta, quando o lixo é depositado em caçamba, tanque ou outro depósito, sendo posteriormente coletado por serviço ou empresa de limpeza urbana (pública ou privada) (Fonte: IBGE, Pesquisa Nacional por Amostra de Domicílios - PNAD. Conceitos adotados no questionário de investigação sobre as características da unidade domiciliar).;Para o cálculo das estimativas foram consideradas as informações do desenho amostral. Os gráficos estão acompanhados dos intervalos de confiança (IC 95%).;1998;2013;0;0;3;1;2;1;1;0;0;0;0;1;1;0;S
96;T01;Excesso de peso;Percentual de adultos com excesso de peso.;Foi considerado com obesidade o indivíduo com Índice de Massa Corporal (IMC) >= 30 kg/m2 (WHO, 1995), calculado a partir do peso em quilos dividido pelo quadrado da altura, ambos auto-referidos, conforme as questões: O(a) senhor(a) sabe seu peso (mesmo que seja valor aproximado)?, O(a) senhor(a) sabe sua altura?.;Numerador: número de indivíduos entrevistados de 18 anos ou mais de idade com excesso de peso. Denominador: número de indivíduos de 18 anos ou mais de idade entrevistados.;VIGITEL.;;Anual.;Anual.;2006 - 2016;Capitais.;;Determinantes comportamentais.;O universo da pesquisa do Vigitel é de adultos, com 18 ou mais anos de idade, residentes em uma das capitais dos 26 estados brasileiros e no Distrito Federal, em domicílios servidos por pelo menos uma linha telefônica fixa no ano.;1 - Brasil. Ministério da Saúde. Secretaria de Vigilância em Saúde. Secretaria de Gestão Estratégica e Participativa. Vigitel Brasil 2009: vigilância de fatores de risco e proteção para doenças crônicas por inquérito telefônico. Brasília: Ministério da Saúde, 2010. 150 p.: il. - (Série G. Estatística e Informação em Saúde). 2 - Brasil. Ministério da Saúde. Secretaria de Vigilância em Saúde. Secretaria de Gestão Estratégica e Participativa. Vigitel Brasil 2008: vigilância de fatores de risco e proteção para doenças crônicas por inquérito telefônico. Brasília: Ministério da Saúde, 2009. 112 p.: il. - (Série G. Estatística e Informação em Saúde) ISBN 978-85-334-1731-1. 3 - Brasil. Ministério da Saúde. Secretaria de Vigilância em Saúde. Secretaria de Gestão Estratégica e Participativa. Vigitel Brasil 2007: vigilância de fatores de risco e proteção para doenças crônicas por inquérito telefônico. Brasília: Ministério da Saúde, 2009. 136 p.: il. - (Série G. Estatística e Informação em Saúde) ISBN 978-85-334-1565-2. 4 - Brasil. Ministério da Saúde. Secretaria de Vigilância em Saúde. Secretaria de Gestão Estratégica e Participativa. Vigitel Brasil 2006: vigilância de fatores de risco e proteção para doenças crônicas por inquérito telefônico. Brasília: Ministério da Saúde, 2007. 297 p.: il. - (Série G. Estatística e Informação em Saúde) ISBN 978-85-334-1355-9;;;2006;2016;1;0;3;0;3;0;1;0;0;0;2;1;1;0;S
97;T02;Ingestão abusiva de álcool;Percentual de adultos que consumiram bebida alcoólica de forma abusiva.;Foi considerado consumo abusivo de bebidas alcoólicas cinco ou mais doses (homem) ou quatro ou mais doses (mulher) em uma única ocasião, pelo menos uma vez nos últimos 30 dias. Considera-se para identificar o consumidor abusivo a resposta sim à questão Nos últimos 30 dias, o sr chegou a consumir 5 ou mais doses de bebida alcoólica em uma única ocasião?, para homens, ou Nos últimos 30 dias, a sra. chegou a consumir 4 ou mais doses de bebida alcoólica em uma única ocasião? para mulheres. Uma dose de bebida alcoólica corresponde a uma lata de cerveja, uma taça de vinho ou uma dose de cachaça, whisky ou qualquer outra bebida alcoólica destilada.;Numerador: número de indivíduos entrevistados de 18 anos ou mais de idade que consumiram bebida alcoólica de forma abusiva. Denominador: número de indivíduos de 18 anos ou mais de idade entrevistados.;VIGITEL.;;Anual.;Anual.;2006 - 2016;Capitais.;;Determinantes comportamentais.;O universo da pesquisa do Vigitel é de adultos, com 18 ou mais anos de idade, residentes em uma das capitais dos 26 estados brasileiros e no Distrito Federal, em domicílios servidos por pelo menos uma linha telefônica fixa no ano.;1 - Brasil. Ministério da Saúde. Secretaria de Vigilância em Saúde. Secretaria de Gestão Estratégica e Participativa. Vigitel Brasil 2009: vigilância de fatores de risco e proteção para doenças crônicas por inquérito telefônico. Brasília: Ministério da Saúde, 2010. 150 p.: il. - (Série G. Estatística e Informação em Saúde). 2 - Brasil. Ministério da Saúde. Secretaria de Vigilância em Saúde. Secretaria de Gestão Estratégica e Participativa. Vigitel Brasil 2008: vigilância de fatores de risco e proteção para doenças crônicas por inquérito telefônico. Brasília : Ministério da Saúde, 2009. 112 p.: il. - (Série G. Estatística e Informação em Saúde) ISBN 978-85-334-1731-1. 3 - Brasil. Ministério da Saúde. Secretaria de Vigilância em Saúde. Secretaria de Gestão Estratégica e Participativa. Vigitel Brasil 2007: vigilância de fatores de risco e proteção para doenças crônicas por inquérito telefônico. Brasília: Ministério da Saúde, 2009. 136 p.: il. - (Série G. Estatística e Informação em Saúde) ISBN 978-85-334-1565-2. 4 - Brasil. Ministério da Saúde. Secretaria de Vigilância em Saúde. Secretaria de Gestão Estratégica e Participativa. Vigitel Brasil 2006: vigilância de fatores de risco e proteção para doenças crônicas por inquérito telefônico. Brasília: Ministério da Saúde, 2007. 297 p.: il. - (Série G. Estatística e Informação em Saúde) ISBN 978-85-334-1355-9;;;2006;2016;1;0;3;0;3;0;1;0;0;0;2;1;1;0;S
98;T03;Inatividade física;Percentual de adultos fisicamente inativos.;"""Foi considerado fisicamente inativo o adulto que não praticou qualquer atividade física no tempo livre nos últimos três meses e que não realizou esforços físicos intensos no trabalho, não se deslocou para o trabalho ou escola caminhando ou de bicicleta perfazendo um mínimo de 10 minutos por trajeto por dia e não foi responsável pela limpeza pesada de sua casa, conforme combinação das questões: Nos últimos três meses, o(a) sr(a) praticou algum tipo de exercício físico ou esporte?";"Nos últimos três meses, o(a) sr(a) trabalhou? e No seu trabalho, o(a) sr(a) anda bastante a pé?, ou No seu trabalho, o(a) sr(a) carrega peso ou faz outra atividade pesada?"""", O(a) sr(a) costuma ir a pé ou de bicicleta de casa para o trabalho? e Quanto tempo o(a) sr(a) gasta para ir e voltar do trabalho (a pé ou de bicicleta)? e Atualmente, o(a) sr(a) está frequentando algum curso/escola ou leva alguém em algum curso/escola?, Para ir ou voltar a este curso ou escola, faz algum trajeto a pé ou de bicicleta? e Quanto tempo o(a) sr(a) gasta para ir e voltar neste trajeto (a pé ou de bicicleta)? e Quem costuma fazer a faxina da sua casa? ou Quem fica com a parte mais pesada da faxina, quando tem ajuda?.""";Numerador: número de indivíduos entrevistados de 18 anos ou mais de idade fisicamente inativos. Denominador: número de indivíduos de 18 anos ou mais de idade entrevistados.;VIGITEL.;;Anual.;Anual.;2006 - 2016;Capitais.;;Determinantes comportamentais.;O universo da pesquisa do Vigitel é de adultos, com 18 ou mais anos de idade, residentes em uma das capitais dos 26 estados brasileiros e no Distrito Federal, em domicílios servidos por pelo menos uma linha telefônica fixa no ano.;1 - Brasil. Ministério da Saúde. Secretaria de Vigilância em Saúde. Secretaria de Gestão Estratégica e Participativa. Vigitel Brasil 2009: vigilância de fatores de risco e proteção para doenças crônicas por inquérito telefônico. Brasília: Ministério da Saúde, 2010. 150 p.: il. - (Série G. Estatística e Informação em Saúde). 2 - Brasil. Ministério da Saúde. Secretaria de Vigilância em Saúde. Secretaria de Gestão Estratégica e Participativa. Vigitel Brasil 2008: vigilância de fatores de risco e proteção para doenças crônicas por inquérito telefônico. Brasília: Ministério da Saúde, 2009. 112 p.: il. - (Série G. Estatística e Informação em Saúde) ISBN 978-85-334-1731-1. 3 - Brasil. Ministério da Saúde. Secretaria de Vigilância em Saúde. Secretaria de Gestão Estratégica e Participativa. Vigitel Brasil 2007: vigilância de fatores de risco e proteção para doenças crônicas por inquérito telefônico. Brasília: Ministério da Saúde, 2009. 136 p.: il. - (Série G. Estatística e Informação em Saúde) ISBN 978-85-334-1565-2. 4 - Brasil. Ministério da Saúde. Secretaria de Vigilância em Saúde. Secretaria de Gestão Estratégica e Participativa. Vigitel Brasil 2006: vigilância de fatores de risco e proteção para doenças crônicas por inquérito telefônico. Brasília: Ministério da Saúde, 2007. 297 p.: il. - (Série G. Estatística e Informação em Saúde) ISBN 978-85-334-1355-9;;0;2006;2016;1;0;3;0;3;;1;0;0;0;2;1;1;0
99;T04;Tabagismo;Percentual de adultos fumantes.;"""""""Foi considerado fumante o indivíduo que respondeu positivamente à questão """"""""O(a) sr(a) fuma?"""""""", independente do número de cigarros, da frequência e da duração do hábito de fumar.""""""";Numerador: número de indivíduos entrevistados de 18 anos ou mais de idade que fumam. Denominador: número de indivíduos de 18 anos ou mais de idade entrevistados.;PNAD e PNS.;;Quinquenal.;Quinquenal.;2008 - 2013;Brasil, Grandes Regiões e UFs.;;Determinantes comportamentais.;;;;;2008;2013;1;0;3;0;0;0;1;0;0;0;0;1;1;0;S
